37,VP HR,"Senior Management (Associate Director, Director, Senior Director)",HK & Macau,Yes,Yes,Stress management;Nutrition;Exercise & Fitness;Ergonomics;Mental Health;Leadership,Yes,Yes,"Football, basketball teams, GoGreen, GoHelp events, budget for social gatherings, etc.",Yes,Yes,"Water, coffee, tea and fruits occasionally",Yes,Gym,Yes,Gym and adjustable desk,"Sports activities, continuing education opportunities","Health check ups, surveys, etc.","Employee oriented, open and friendly",Melanie Wong and Grace Chan,Melanie Wong and Chee Choong Ng,Daily,Daily,Daily,Daily,Daily,Daily,Half the time,Daily,Daily,Daily,Daily,Daily,Daily,3,2,3,3,2,3,3,2,3,6,5,4,1,N/A,0,No thanks
23,HR Executive,Entry (Associate),HK & Macau,Yes,Yes,Yoga,Yes,No,,No,Yes,"juice, fruit",Yes,"library, social area",Yes,standup desk,yoga classes,N/A,"Friendly, willing to help, fast",Melanie Wong,Melanie Wong,Most days,Most days,Most days,Most days,Most days,Most days,Half the time,Daily,Half the time,Once a week,Once a week,Once a week,Once a week,1,1,1,1,1,1,1,1,1,1,1,1,1,N/a,0,"Maybe, depends on the time committment"
31,Human Resources Operations Manager,"Middle Management (Manager, Senior Manager)",HK & Macau,Yes,Yes,Stress management;Nutrition;Sleep;Exercise & Fitness;Aging;Yoga;Ergonomics;Mindfulness;Breathing;Mental Health;Workplace Hygiene;Holistic Wellness;Leadership,Yes,Yes,Organised a yoga class and encouraged staff to join,No,Yes,Fruits and healthy food vending machines,Yes,Provides Bicycle in work place,Yes,"Stand up desk, yoga mat","continuing education opportunities, provides fruits to staff","Provide Blood Pressure Monitor, health program to staff to understand their health situation ","Focus on people, connect people, respect people ",Christina Wong,Wing Ho,Daily,Daily,Daily,Daily,Daily,Daily,Half the time,Daily,Daily,Half the time,Half the time,Daily,Daily,1,1,1,1,1,1,1,1,1,1,1,1,1,No,0,I'd like to know more please!
12,Sr Mgr Bisness HR,"Middle Management (Manager, Senior Manager)",HK & Macau,Yes,Yes,Stress management;Ergonomics,Yes,Yes,Fundraising activities ,No,Yes,"Tea, coffee, biscuits, nuts",Yes,"Gym, activity room, nap room ",Yes,"Standup desk, phone booth","After work gym, mobile work",Survey,People oriented ,Grace Chan,"Angel Ng, Javin Chan",Once a week,Once a week,Once a week,Once a week,Half the time,Once a week,Once a week,Half the time,Once a week,Rarely / Never,Rarely / Never,Once a week,Rarely / Never,6,6,6,4,5,5,4,3,3,3,4,5,4,No,0,No thanks
37,HRBP,"Middle Management (Manager, Senior Manager)",Taiwan,Yes,Yes,Exercise & Fitness;Yoga;Ergonomics;Workplace Hygiene;Leadership,Yes,Yes,"arrange seminars, host yoga club and provide venue, distribute newsletters, arrange flu injections",Yes,No,,Yes,a multi-functional lounge ,No,,yoga is put on hold due to covid,health check-ups,"strong teamwork, can do, strong bond","terry cheng, kelly shih","angie hung, queena chou",Most days,Most days,Most days,Most days,Most days,Most days,Most day,Most days,Most days,Most days,Most days,Most days,Most days,6,3,5,5,3,6,5,5,6,4,6,4,3,N/A,0,"Maybe, depends on the time committment"
24,HR Business Manager - Country CIS Lead,"Middle Management (Manager, Senior Manager)",Malaysia & Brunei,Yes,Yes,Exercise & Fitness;Ergonomics,Yes,Yes,"Baked for charity contribution, fitness challenge within the team on steps ",No,Yes,"Biscuits, coffee, tea, water ",Yes,"Gym, quiet area ",No,,Bi-weekly exercise,Health check ups ,"Great work place, Employees first ",Samantha Wong,Chong Chee Fei,Daily,Daily,Daily,Daily,Daily,Most days,Once a week,Half the time,Most days,Rarely / Never,Half the time,Once a week,Half the time,2,2,3,1,2,1,2,2,2,2,1,1,2,No,0,"Maybe, depends on the time committment"
30,Business HR Manager,"Middle Management (Manager, Senior Manager)",Malaysia & Brunei,Yes,Yes,Ergonomics;Workplace Hygiene;Holistic Wellness,Yes,Yes,Fitness challenge competition. ,Yes,Yes,"Coffee, tea, healthy snack ",Yes,Gym ,No,,"Team building, weekly wellness broadcas  ",Medical check,"Open communication, caring, supportive ","Joann Tan, Shi Wan Chew","Jasweet Dhillon, Samantha Wong",Daily,Daily,Daily,Daily,Daily,Daily,Rarely / Never,Daily,Half the time,Rarely / Never,Once a week,Most days,Daily,4,4,3,3,2,1,1,1,1,2,2,2,2,No,0,"Yes, absolutely"
33,HR Executive ,Entry (Associate),Malaysia & Brunei,Yes,Yes,Stress management;Exercise & Fitness;Ergonomics;Leadership,Yes,Yes,"Bake for charity, CSR for school kids",Yes,Yes,"Vending machine, healthy snack , mineral water",Yes,Gym,Yes,"Bluetooth headphones, stress ball, ergonomic chair","Health and Wellness week, team building ",Yearly full body health check up is done,"AsOne, Speed and Passion",Ee Lin Ooi and Joann,Ee Lin Ooi and Samantha Wong Keng Mun,Daily,Daily,Daily,Daily,Daily,Daily,Half the time,Most days,Most days,Half the time,Half the time,Most days,Most days,4,4,1,2,1,1,2,3,1,2,1,4,2,No,0,"Maybe, depends on the time committment"
31,HR Executive,Entry (Associate),Malaysia & Brunei,Yes,Yes,Nutrition;Exercise & Fitness;Ergonomics;Workplace Hygiene,Yes,Yes,"Sponsorship, organizing the program and supporting the implementation.",No,Yes,"Energy bar snack, fruit juice, milk, coffee/ tea with less sugar advisable etc",Yes,Gym,Yes,Ergonomic chair,Yearly Team Building,Annual screening,Resilient towards challenge,Ooi Ee Lin and Tan Ai Lee,Ooi Ee Lin and Cheow Yang Lee,Most days,Daily,Most days,Daily,Most days,Daily,Once a week,Daily,Most days,Rarely / Never,Once a week,Most days,Half the time,5,3,5,3,1,1,1,3,2,3,3,4,3,No comment and thanks,1,"Yes, absolutely"
33,HR Business Manager,"Middle Management (Manager, Senior Manager)",Philippines,Yes,Yes,Stress management;Nutrition;Sleep;Exercise & Fitness;Yoga;Ergonomics;Mindfulness;Breathing;Mental Health;Workplace Hygiene;Holistic Wellness;Leadership,Yes,Yes,"fundings, guest speaker and others",Yes,Yes,fruits,Yes,gys,Yes,"ergo chairs, work stations maintaining physical distancing",mental wellness talk and weekly/daily physical wellness bulletin well,interviews ,people centered,Matt Jun Advincula and Maville Alferez,May Lopez,Daily,Daily,Daily,Daily,Daily,Daily,Most day,Most days,Daily,Half the time,Half the time,Once a week,Most days,2,4,3,5,4,4,4,3,3,3,2,2,3,none,0,"Maybe, depends on the Coach"
27,C&B Analyst,Entry (Associate),HK & Macau,Yes,Yes,body check,Yes,Yes,running for fundraising,No,Yes,coffee and tea,Yes,"gym room, recreation room",Yes,desk,team building,Employee Opinion Survey,"As One, Can Do",Grace and Melani,Anthony and Angel,Most days,Daily,Daily,Daily,Most days,Most days,Once a week,Once a week,Most days,Rarely / Never,Rarely / Never,Once a week,Once a week,3,3,3,3,3,3,3,3,3,3,3,3,3,balance of work,1,"Maybe, depends on the time committment"
36,HR EXECUTIVE,Entry (Associate),Malaysia & Brunei,Yes,Yes,Exercise & Fitness,Yes,Yes,"Bake for Charity, Fitness Challenge",Yes,Yes,"Snack bars, coffee machine, water",Yes,"gym, social area",Yes,"Ergonomic Allowance, Bluetooth Headphone, mask",Team Building and Exercise,Arrangement of Covid Vaccination. Twice per year Flu Vaccination,"Supportive, Generous and Caring",Ee Lin and Samantha Wong Keng Mun,Jasweet and Shi Wan,Most days,Daily,Daily,Daily,Daily,Most days,Rarely / Never,Most days,Most days,Daily,Once a week,Daily,Daily,2,1,3,1,1,2,2,1,1,1,1,1,1,No everything is good,1,"Yes, absolutely"
30,HR Talent Manager ,"Middle Management (Manager, Senior Manager)",Malaysia & Brunei,Yes,Yes,Stress management;Exercise & Fitness;Mental Health;Workplace Hygiene;Leadership,Yes,Yes,"Baked for charity, go teach, fitness week ",No,Yes,"Monthly vitamins supplements,  coffee & tea machine",Yes,"Gym, mommy room, prayer room for Muslims",Yes,"Laptop support, stress balls, noise cancelling headphones ",Virtual team building,"Health checks, vaccination,  engagement activities ","Positive,  passion & energetic ",Ee Lin Ooi & Ai Lene Tan,"Chee Fei Chong, Cheow Yang Lee ",Daily,Daily,Daily,Daily,Daily,Most days,Once a week,Half the time,Most days,Rarely / Never,Half the time,Most days,Daily,4,2,1,2,4,3,1,3,4,2,1,1,1,Nil,0,"Maybe, depends on the time committment"
31,C&B Manager,"Middle Management (Manager, Senior Manager)",Malaysia & Brunei,Yes,Yes,Nutrition;Exercise & Fitness;Ergonomics;Mental Health;Workplace Hygiene;Holistic Wellness,Yes,Yes,"Exercise, team building",Yes,Yes,"Coffee, tea, drinking water, biscuits",Yes,"Gym, social area, sky garden",Yes,"Ergonomic chair, dress balls, cancelling headphones ",Health awareness continue notification prevention,Yes,"As One, Fit to Lead","Ooi Ee Lin, Samantha Wong","Sharon Law, Samantha Wong",Most days,Most days,Most days,Most days,Most days,Most days,Once a week,Most days,Most days,Half the time,Once a week,Half the time,Most days,1,1,1,1,1,1,1,1,1,1,1,1,1,Work life balance,1,"Maybe, depends on the time committment"
33,Business HR Manager,"Middle Management (Manager, Senior Manager)",Malaysia & Brunei,Yes,Yes,Mental Health;Team building,Yes,Yes,Bake for charity and we do have our internal fitness challenge,Yes,Yes,Beverages and meals for us during this pandemic,Yes,Gym with exercise equipment,Yes,High quality headset and office equipment,On going monthly engagement activities. Eg celebration based on festive season ,We have health check and activities based on that intiatives,"People , strong culture and growth",Ooi Ee Lin and Tan Ai Lene,Ooi Ee Lin and Joann Tan Ai Lene,Daily,Daily,Daily,Daily,Daily,Daily,Once a week,Most days,Daily,Once a week,Rarely / Never,Most days,Most days,4,5,5,5,5,5,5,5,5,5,5,6,6,No,0,I'd like to know more please!
39,Head of HR,"Middle Management (Manager, Senior Manager)",Cambodia,Yes,Yes,Exercise & Fitness;Yoga;Workplace Hygiene,Yes,Yes,,Yes,Yes,Subsidy Lunch Program,Yes,,Yes,"Gym , Yoga mat",Yoga classes ,"Health check-up, Survey","Team spirit ,  team engagement","Bopha CHAN , Ponloeu Oung","Bunthan Suy , Kimteang Ly",Daily,Daily,Daily,Daily,Daily,Daily,Daily,Daily,Daily,Most days,Most days,Most days,Most days,5,1,6,2,1,4,3,2,2,2,1,2,1,No comment/question,0,"Yes, absolutely"
24,Compensation and Benefits Specialist,"Middle Management (Manager, Senior Manager)",Malaysia & Brunei,Yes,Yes,Exercise & Fitness;Ergonomics;Workplace Hygiene,Yes,Yes,International women day. Company encourage all employee to exercise together follow session / time arranged,Yes,Yes,"Coffee & tea machine,fruit, supplement",Yes,MY express country office gym room,Yes,"Ergonomic chair, jumping rope, stress ball","Team building, newsletter on personally hygience",Medical health screening,Employee centric,"Ee Lin Ooi, keng mun wong","Keng mun wong, ee lin ooi",Once a week,Most days,Most days,Most days,Most days,Once a week,Once a week,Most days,Half the time,Rarely / Never,Once a week,Half the time,Half the time,4,4,4,3,3,3,4,2,3,2,3,3,2,"Work Life Balance, stress Management",1,"Maybe, depends on the time committment"
18,Senior Manager Business HR,"Middle Management (Manager, Senior Manager)",HK & Macau,Yes,Yes,Stress management;Nutrition;Ergonomics;Leadership,Yes,No,,No,Yes,"tea, coffee, nuts, biscuits",Yes,gym,Yes,"standup desk, ergonomic chair, phone booths",team building activities ,"health check-ups, surveys","caring, progressive","Grace Chan, Melanie Wong","Melanie Wong, Angel Ng",Half the time,Most days,Most days,Half the time,Most days,Half the time,Half the time,Half the time,Half the time,Once a week,Once a week,Once a week,Once a week,4,5,1,6,4,2,3,2,2,3,3,3,3,arrange yoga class ,1,"Maybe, depends on the time committment"
14,HR Business Partner Manager,"Middle Management (Manager, Senior Manager)",Malaysia & Brunei,Yes,Yes,Exercise & Fitness,Not sure,Yes,,No,Yes,,Yes,,Yes,,Weekly sharing sessions,Yearly medical screening,"Engaging, employee oriented",Ooi Ee Lin,Ooi Ee Lin,Half the time,Half the time,Half the time,Most days,Most days,Half the time,Half the time,Half the time,Half the time,Rarely / Never,Rarely / Never,Rarely / Never,Rarely / Never,2,2,3,3,2,2,1,2,1,2,2,1,3,Not at the moment,0,"Maybe, depends on the time committment"
33,Performance and Program Specialist ,"Middle Management (Manager, Senior Manager)",Malaysia & Brunei,Yes,Yes,Stress management;Nutrition;Sleep;Exercise & Fitness;Aging;Ergonomics;Mental Health;Workplace Hygiene;Leadership,Yes,Yes,,Yes,Yes,,Yes,,Yes,,Monthly wellness newsletter ,Annual health screening,Best/Great/Fit,Ee Lin / Samantha ,Ee Lin,Most days,Daily,Daily,Most days,Daily,Most days,Rarely / Never,Daily,Half the time,Rarely / Never,Most days,Most days,Most days,1,2,3,1,3,3,1,1,3,3,1,2,1,NIL all good,1,"Yes, absolutely"
29,"Senior Manager, Business HR - Victoria & South Australia ","Middle Management (Manager, Senior Manager)",Australia,Yes,Yes,Stress management;Nutrition;Sleep;Exercise & Fitness;Aging;Yoga;Ergonomics;Mindfulness;Breathing;Mental Health;Workplace Hygiene;Holistic Wellness;Leadership;Virtual team building,Not sure,Yes,Fund-raising - either matched the amount raised or offered to sponsor the shipping cost,Yes,Yes,Fruit and veg gift box,Yes,"Ping pong table, digital library",Yes,"standup desk, ergonomic chair, yoga mat, noise-cancelling headphones","Friday's after work virtual catch up, and quarterly virtual team building ",Work health and safety measures,"Open, respectful and inclusive",Laura Leighton & Shaista Khambiye,Veronica Evison & Sandra Strong,Half the time,Daily,Most days,Most days,Most days,Most days,Once a week,Once a week,Half the time,Daily,Daily,Daily,Half the time,3,1,6,3,3,2,1,6,4,4,2,1,5,"In DHL, everyone is responsible for the company culture. I do not understand the reason for asking the question if there is a dedicate employee, team or committee being responsible for the company culture.",1,"Maybe, depends on the time committment"
17,Senior Manager Business HR,"Middle Management (Manager, Senior Manager)",Australia,Yes,Yes,Stress management;Nutrition;Sleep;Exercise & Fitness;Aging;Yoga;Ergonomics;Mindfulness;Breathing;Mental Health;Workplace Hygiene;Holistic Wellness;Leadership,Not sure,Yes,various forms of fundraisers (Sutho2Surf; City2Surf); participating in Clean Up days; ,Yes,Yes,"coffee, tea, vending machine; when in office - optional cafe food",Yes,lunch room when not in lockdown,Yes,standup desk; ergo chair; phone booths,monthly Healthworks emails/information; H&W monthly calendar of events,don't know; this is private individual information,connected; safe; family,Laura Leighton; Shaista Khambiye,Leigh Phillips; Veronica Evison,Once a week,Most days,Rarely / Never,Most days,Most days,Rarely / Never,Rarely / Never,Rarely / Never,Rarely / Never,Once a week,Rarely / Never,Once a week,Once a week,2,6,2,2,5,2,2,4,5,4,2,5,3,no,0,"Maybe, depends on the time committment"
29,Senior Manager WHS,"Middle Management (Manager, Senior Manager)",Australia,Yes,Yes,Stress management;Nutrition;Sleep;Exercise & Fitness;Aging;Ergonomics;Mindfulness;Breathing;Mental Health,Yes,Yes,"Tree Planting - time off, Clean Up days ",Yes,Yes,Fresh fruit weekly,Yes,Wellness room - massage chairs,Yes,"stand up desks, ","Health portal, Activate my Wellbeing",Reports from supplier,"Caring, inclusive, supportive","Sandra Strong, Laura Leighton","Sandra Strong, Shelley Elms",Most days,Most days,Most days,Most days,Most days,Most days,Half the time,Most days,Once a week,Once a week,Rarely / Never,Half the time,Most days,2,3,3,2,2,3,2,2,2,1,1,2,2,No,0,"Maybe, depends on the Coach"
30,HR Executive,Entry (Associate),India,Yes,Yes,Stress management;Exercise & Fitness;Yoga;Ergonomics;Mindfulness;Breathing;Mental Health;Holistic Wellness;Leadership,Yes,Yes,"Fitness Challenges, Yoga Classes",Yes,Yes,"Fresh Fruits, bottled mineral water",No,,Yes,"Yoga mats, stress ball, ","Yoga classes, team building workshops, non-work related check ins","Health check-ups, surveys, feedbacks","Employee centric, Customer Centric, Vibrant","Alisha Abraham, Saurabh Dalvi","Alisha Abraham, Sharon Dsouza",Most days,Most days,Most days,Most days,Most days,Half the time,Daily,Most days,Half the time,Rarely / Never,Once a week,Daily,Most days,1,2,3,3,1,2,1,1,1,2,1,2,1,NA,0,"Yes, absolutely"
32,WHS Administrator,Entry (Associate),Australia,Yes,Yes,Stress management;Nutrition;Sleep;Exercise & Fitness;Aging;Yoga;Ergonomics;Mindfulness;Breathing;Mental Health;Workplace Hygiene;Holistic Wellness;Leadership,Yes,Yes,"Participants in Sleep Under the Stars, tree planting events, Clontarf Foundation, MS Brissie to the Bay, Steptember...",Yes,Yes,"Coffee, black/green/peppermint tea, Milo, stevia/white/raw sugars, Nespresso machine, weekly fruit and milk, hot/cold filter tap",Yes,"""Zen"" rooms with board games, foosball table, ping pong tables, bean bags, giant wall Scrabble, little free library shelves",Yes,"Massage chair, electronic sit/stand desks, Okamura ergonomic office chairs, wireless telephone headsets (call centre), phone booths, LED lighting (fluorescent lighting is too dark and causes eye strain)",Health and Wellbeing Subsidy where staff can claim AUD$200.00 per financial year for health/wellbeing/addiction quitting programs //// regular Zoom webinars about mindfullness/meditiation,"Origami QAS Portal lodged quarterly to Global with all health and wellbeing initiatives like skin checks, flu vax, Covid RAT kit management.",Open-minded. Accepting. Positive. ,"Laura Leighton, Shaista Khambiye","Brian Shawcross, Veronica Evison.",Half the time,Daily,Daily,Daily,Most days,Half the time,Once a week,Most days,Most days,Rarely / Never,Most days,Daily,Most days,4,4,2,4,2,1,1,2,2,2,2,2,2,"Perhaps a guide on how to maintain regular working hours. Working from home, one can lose track of time and inadvertently work 15 hours straight without realising it. ",1,"Maybe, depends on the time committment"
21,Resourcing executive,Entry (Associate),Taiwan,Yes,Yes,Stress management;Exercise & Fitness;Aging;Ergonomics;Workplace Hygiene;Holistic Wellness;Leadership,Yes,Yes,,No,No,,No,,No,,We have monthly team building before covid-19,health check-ups,"As one! can do, golden speed","Kelly Shih, Terry Cheng","Kelly is nurse, Terry often climbing",Most days,Most days,Daily,Most days,Most days,Most days,Once a week,Once a week,Once a week,Once a week,Rarely / Never,Once a week,Once a week,5,1,6,1,1,4,1,5,5,5,5,3,3,no,0,No thanks
18,HR performance analyst,Entry (Associate),Taiwan,Yes,Yes,Ergonomics;Holistic Wellness,Yes,Yes,Global Volunteer Day,No,No,,No,,Yes,ergonomic chair,"team building, workshops",health check-ups,"globalization, diversified","Terry Cheng, Liana Xie","Terry Cheng, Joanne Chen",Half the time,Daily,Daily,Most days,Half the time,Half the time,Half the time,Most days,Once a week,Once a week,Once a week,Once a week,Half the time,1,4,3,3,1,1,2,2,1,1,1,3,3,no,0,"Maybe, depends on the Coach"
36,Safety Officer,Entry (Associate),Philippines,Yes,Yes,Stress management;Nutrition;Yoga;Mental Health,Yes,Yes,,Yes,Yes,"Fruits, Nutritious meals",Yes,Gym,Yes,"ergonomic chair, noise cancelling headphones, ergonomics rubber mat","continuing education opportunities, virtual get together","Focus group, check up","safe, health and strong","Maville Alferez, Jona Ferrer","Timothy John Tulay, Rose Anne Penelope",Daily,Daily,Daily,Daily,Daily,Daily,Once a week,Daily,Daily,Once a week,Daily,Daily,Daily,6,6,5,4,3,2,1,6,5,4,3,2,1,I'm very satisfied and grateful with the initiatives and support provided by the management. ,1,"Maybe, depends on the time committment"
23,HR business Manager ,"Middle Management (Manager, Senior Manager)",Taiwan,Yes,Yes,Stress management;Exercise & Fitness;Ergonomics;Mental Health,Not sure,Yes,"Tree planting, Mountain/beach cleaning ",Yes,Yes,lunch box,Yes,Staff lounge ,Yes,ergonomic chair,"Hiking, dragon boat",health check-ups,"Open, fair",Angie Hung,Kelly Shih,Most days,Most days,Most days,Most days,Most days,Most days,Once a week,Half the time,Half the time,Rarely / Never,Once a week,Once a week,Once a week,2,2,5,2,3,3,5,2,2,5,1,4,2,No,0,"Maybe, depends on the time committment"
37,Functional Coordinator,Entry (Associate),HK & Macau,Yes,Yes,Nutrition,Yes,Yes,after-work social gatherings,Yes,Yes,snack bar,Yes,gym room,Yes,"standup desk, ergonomic chair",seminars,health check-ups,"can do, right first time",XXX,XXX,Daily,Daily,Daily,Daily,Daily,Most days,Most day,Most days,Most days,Most days,Most days,Most days,Most days,3,3,4,4,3,4,5,3,3,4,3,4,4,Nil,0,No thanks
34,Human Resources Executive,Entry (Associate),HK & Macau,Yes,Yes,Stress management;Nutrition;Exercise & Fitness;Mindfulness;Mental Health;Workplace Hygiene,Yes,Yes,breast cancer fund raising,Yes,Yes,fruits,Yes,"gym room, recreation room",Yes,"standup desk, ergonomic chair, gym equipments","Health & safety week, stand-up desk",no idea,"Fit for Work, Fit for Life","Anthony Wong, Nicole Lau","Anthony Wong, Nicole Lau",Most days,Daily,Daily,Daily,Daily,Most days,Daily,Daily,Daily,Half the time,Half the time,Most days,Most days,5,5,5,5,5,5,5,5,5,5,5,5,5,nil,0,"Yes, absolutely"
35,HRBP,"Middle Management (Manager, Senior Manager)",Thailand,Yes,Yes,Nutrition;Workplace Hygiene,Yes,Yes,"Sport Club such as Badminton, Running",Yes,Yes,"Salad, Fruit juice, etc.",Yes,"Yoka Class, Promotion for Fitness Member",Yes,Stress Ball,"Team Building, Yoga Class",Yearly Health Check Up,"Connective People, Improving Life. / Respect and Result","Sarayut Sarayot, Sinee Kesdech",Khingpai Viyanut,Daily,Daily,Daily,Daily,Daily,Daily,Rarely / Never,Daily,Daily,Once a week,Most days,Daily,Daily,1,1,1,1,1,1,1,1,1,1,1,1,1,No,0,I'd like to know more please!
13,Resourcing Executive ,Entry (Associate),HK & Macau,Yes,Yes,Exercise & Fitness;Mental Health;Workplace Hygiene;Leadership,Yes,Yes,Sport activity,No,Yes,"Coffee, biscuits",Yes,Gym room,Yes,Standup desk,Company encourage employee utilise the usage of gym room ,Not sure,"As one, caring",Grace Chan and Melanie ,Anthony Wong,Once a week,Most days,Once a week,Once a week,Once a week,Once a week,Rarely / Never,Rarely / Never,Rarely / Never,Rarely / Never,Rarely / Never,Half the time,Rarely / Never,2,1,6,5,4,3,3,2,3,5,4,6,1,Don’t judge and understand instead.,1,"Yes, absolutely"
25,WHS Manager,"Middle Management (Manager, Senior Manager)",Australia,Yes,Yes,Stress management;Nutrition;Exercise & Fitness;Mental Health,Not sure,No,,Yes,No,,Yes,wellbeing room with 2 message chair available,Yes,"standup desk, yoga mat",team building,"health check, surveys","health & wellbeing, mental health","Poh Ling Ng, Laura Leighton",Pohn Ling Ng Maria Fealofani,Daily,Most days,Most days,Daily,Daily,Daily,Once a week,Rarely / Never,Most days,Half the time,Once a week,Rarely / Never,Rarely / Never,5,5,5,5,6,5,5,6,5,5,5,5,5,Onsite gym or subside gym membership,1,"Yes, absolutely"
32,Payroll,Entry (Associate),Australia,Yes,Yes,Yoga;Mindfulness;Mental Health;Workplace Hygiene,Not sure,Yes,Team Building,Yes,Yes,"Fruit, Coffee, Tea, Filtered Water ",Yes,"Message Chair, Exercise Bike",Yes,"Stand up desk, noise-cancelling headphones, ergonomic chair, Booths",Team Building,Skin Check,"Motivating, Flexible, Connected",Laura Leighton & Shaista Khambiye,Brian Shawcross & Maria Fealofani,Most days,Daily,Daily,Daily,Most days,Most days,Daily,Once a week,Most days,Half the time,Rarely / Never,Most days,Most days,2,2,3,3,2,2,2,2,2,1,1,1,1,N/A,0,No thanks
34,Kronos Analyst,Entry (Associate),Australia,Yes,Yes,Yoga;Mindfulness;Mental Health;Workplace Hygiene,Yes,Yes,"Dinners team, building",Yes,Yes,fruit various drinks coffee /tea milo,Yes,massage chairs library exercise equipment,Yes,Stand up desk ergonomic chair,team building ,skin health checks,positive motivating conected,"laura leighton, Sheista K Hambiye","Brian Shawcross,Maria Fealofani",Most days,Most days,Most days,Most days,Daily,Most days,Daily,Once a week,Most days,Half the time,Rarely / Never,Most days,Most days,1,2,1,3,2,1,1,3,2,1,1,1,1,we have a well balanced workplace,1,No thanks
28,Payroll Analyst,Entry (Associate),Australia,Yes,Yes,Yoga;Mindfulness;Mental Health;Workplace Hygiene,Not sure,Yes,Team Building,Yes,Yes,"Fruits, coffee, tea, filtered water",Yes,"Library, Message Chair, Exercise Bike",Yes,"Standup desk, ergonomic chair, noice-cancelling headphones",Team Building,"Health check-ups, Skin check","Motivating, Flexible, Connected","Laura Leighton, Shaista Khambiye","Brian Shawcross, Maria Fealofani",Most days,Daily,Daily,Daily,Most days,Most days,Rarely / Never,Once a week,Most days,Half the time,Rarely / Never,Once a week,Most days,2,2,2,3,1,2,1,2,2,1,1,1,1,n/a,0,No thanks
29,"Senior Manager, Compensation & Benefits, AU","Middle Management (Manager, Senior Manager)",Australia,Yes,Yes,Stress management;Nutrition;Sleep;Exercise & Fitness;Ergonomics;Mindfulness;Mental Health;Workplace Hygiene;Leadership,No,Yes,"The company supports many different activities across the country, promoting the fundraising, donating etc ",Yes,Yes,"Fruit Box, tea & coffee",Yes,Zen rooms,Yes,"Stand up desks, erg chairs","Online Health Portal, team building sessions every three weeks ",Surveys ,"Passion, can do, fun",Laura Leighton ,Shelley Elms,Most days,Daily,Daily,Daily,Most days,Most days,Daily,Once a week,Most days,Once a week,Rarely / Never,Rarely / Never,Most days,4,1,4,1,1,6,6,2,1,1,6,6,6,N/A,0,No thanks
37,Executive assistant,Entry (Associate),Australia,Yes,Yes,Mental Health,Yes,Yes,,Yes,Yes,,No,,Yes,,"team building, mental health sessions",health check ins,"safety first, family, care",Shaista Khambiye & Nonna Pasion , ,Most days,Most days,Most days,Most days,Most days,Most days,Most day,Most days,Most days,Most days,Most days,Most days,Most days,5,5,4,2,2,1,1,2,3,1,1,2,2,n ,0,"Maybe, depends on the Coach"
