18,HR Manager,"Middle Management (Manager, Senior Manager)",Papua New Guinea,Yes,Not sure,Not sure - Just joined in July 2021,Yes,Yes,Sports teams,No,Yes,Tea & Coffee,No,,No,,Team building activities,Not sure - Just joined in July 2021.,"Busy, happy & alive",Nil,Nil ,Most days,Most days,Most days,Daily,Most days,Most days,Rarely / Never,Once a week,Once a week,Rarely / Never,Rarely / Never,Rarely / Never,Once a week,6,5,6,4,5,5,5,6,6,5,5,5,6,No further comments. ,0,"Yes, absolutely"
20,HR Executive,Entry (Associate),Philippines,Yes,Yes,Stress management;Exercise & Fitness;Yoga;Breathing;Mental Health;Holistic Wellness,Not sure,Yes,online hobby club,Yes,Yes,"every day fruits are provided, healthier food are offered",Yes,"pre-pandemic, gym facilities and discount subscription",Yes,"ANC headphones, backjoy for facilitators","hr dinner, game night",health check ups,fit to lead,"jona ferrer, maville alferez","may lopez, timothy tulay",Half the time,Half the time,Daily,Daily,Most days,Half the time,Once a week,Once a week,Rarely / Never,Once a week,Once a week,Once a week,Most days,1,3,6,2,2,1,1,1,1,1,1,3,2,none,0,"Yes, absolutely"
29,Secretary,Entry (Associate),Japan,Yes,Yes,Leadership,Yes,Yes,"Pre-covid, - Softball tournament, Music festival, etc.",Yes,Yes,"Vending machine - canteen - protein drinks, yogurt drinks, etc.",No,,Yes,ergonomic chair for all desk work employees,continuing education opportunities,Yearly stress check survey conducted,"open, caring, cooperative","Akiko Shimizu, Satoshi Yamaguchi","Kyohei Morita, Chizuko Watanabe",Most days,Daily,Most days,Most days,Most days,Most days,Half the time,Once a week,Half the time,Rarely / Never,Once a week,Daily,Most days,2,1,4,2,2,1,2,2,2,3,1,3,3,Through Covid learned that WFH is possible.  WFH helped reduce work related stress.  Hope that WFH will be part of DHL life post Covid. ,1,"Maybe, depends on the time committment"
27,HR Exective (Operations),Entry (Associate),Philippines,Yes,Yes,Stress management;Exercise & Fitness;Yoga;Mindfulness;Breathing;Mental Health,Yes,Yes,Yoga Class,Yes,Yes,"Water, food ration",No,,No,,"Engagement Activities like 50 Years Anniv Celeb, Appreciation Week, etc. ",Check ups,"Compassionate, results driven, fun","AJ Jimenez, Matt Advincula","AJ Jimenez, Matt Advincula",Most days,Most days,Daily,Most days,Most days,Half the time,Half the time,Half the time,Half the time,Most days,Most days,Half the time,Most days,3,2,3,1,3,2,2,2,2,2,2,1,3,None,0,"Yes, absolutely"
38,HR Executive,Entry (Associate),Indonesia & E. Timor,Yes,Yes,Stress management;Mindfulness;Mental Health,Not sure,Yes,"yoga classes, basketball team, soccer team",Yes,Yes,"refill mineral water, coffee, tea",Yes,gym,Yes,stress ball,"mindfulness online class, team building workshop",surveys,result & respect,Melisa Kurniawati,Melisa Kurniawati,Most days,Daily,Daily,Daily,Most days,Daily,Most day,Most days,Most days,Most days,Most days,Most days,Most days,6,3,6,4,4,4,6,6,6,5,6,5,5,more healthy snacks ,1,"Maybe, depends on the Coach"
31,HR Executive,Entry (Associate),Indonesia & E. Timor,Yes,Yes,Stress management;Nutrition;Exercise & Fitness;Mindfulness;Breathing;Mental Health;Workplace Hygiene;Holistic Wellness;Leadership,Yes,Yes,"sports teams, fundraisers, yoga classes, fitness challenges, after-work social gatherings",Yes,Yes,"bottled mineral water, juice, coffee, tea, vending machine",Yes,"gym, open space for movement, social area",Yes,"yoga mat, stress ball, noise-cancelling headphones","yoga classes, mental health workshop",survey,respect & result,"Melisa Kurniawati, Rosalia Dwita","Melisa Kurniawati, Rosalia Dwita",Most days,Daily,Daily,Daily,Most days,Most days,Once a week,Daily,Most days,Once a week,Once a week,Once a week,Most days,4,2,6,3,2,1,1,1,3,2,2,2,2,No,0,No thanks
33,Executive HR,Entry (Associate),India,Yes,Yes,Stress management;Nutrition;Exercise & Fitness;Yoga;Ergonomics;Mindfulness;Mental Health;Workplace Hygiene;Holistic Wellness,Yes,Yes,"By Go Help programs, Global Volunteer Day programs, Fitness challenges of occasions like World Health Day, App week, etc",Yes,Yes,"Coffee, Tea, Mineral water, etc",Yes,"Open Space for movement, social area (recreation room)",Yes,"Ergonomic chair, stres balls, headphones, etc","Frequent webinars on various wellness topics, yoga classes, jumba classes, etc.  ",Health check-ups,"Employee centric, Great place to work, Best employer, As-One Family",Alisha Abraham & Ruhanshi Mathur,Sharon Dsouza & Saurabh Dalvi ,Daily,Daily,Daily,Daily,Most days,Daily,Half the time,Most days,Most days,Once a week,Once a week,Most days,Daily,1,3,1,4,1,1,1,1,1,4,3,5,1,No,0,"Yes, absolutely"
26,"Programs, Employee Experience, & Survey Manager cum HRBP","Middle Management (Manager, Senior Manager)",Vietnam,Yes,Yes,Nutrition;Exercise & Fitness;Yoga;Breathing;Mental Health,Not sure,Yes,Sponsorship for hobbies clubs led by employee,Yes,No,,Yes,"Gym, relax room",No,,"Hobby clubs (yoga, foodball, chess,...), healthy eating workshop,..","Employee satisfaction survey, health check up","enegetic, caring","Hang Nguyen, Anh Bui","Long Truong, Hang Nguyen",Most days,Most days,Most days,Most days,Half the time,Most days,Once a week,Most days,Once a week,Once a week,Once a week,Most days,Most days,4,1,6,2,1,1,1,1,2,2,3,3,3,No,0,"Yes, absolutely"
21,Talent Acquisition & Digitalization Manager,"Middle Management (Manager, Senior Manager)",Vietnam,Yes,Yes,Nutrition;Exercise & Fitness;Yoga;Ergonomics;Workplace Hygiene,Yes,Yes,"Hobby Clubs: Yoga, Football, Badminton, Pingpong, Music Band
Fitness challenges: Jumping jack, Plank, Push-up, Body transformation",No,Yes,"Daily: coffee, tea, mineral water. Monthly: Fruit, Snack",Yes,"Gym, Relax room with Massage machine",No,,"Yoga Club, inhouse Gym",Health Check-ups,Respect & Result,"Hang Nguyen, Khang Nguyen","Long Truong, Hang Nguyen",Most days,Most days,Half the time,Daily,Most days,Most days,Once a week,Once a week,Once a week,Once a week,Once a week,Rarely / Never,Half the time,5,6,4,4,5,4,6,6,5,4,6,5,5,N/A,0,I'd like to know more please!
19,"HR Assistant, Talent Acquisition",Entry (Associate),Vietnam,Yes,Yes,Stress management;Nutrition;Ergonomics;Breathing;Workplace Hygiene,Not sure,Yes,"after-work virtual meeting, photo teams,...",No,Yes," litchi fruit, melon, mangoes, jack fruit,...",Yes,"Gym room, quiet area",Yes,"noise-cancelling headphones, ergonomic chair","yoga classes, team-building workshops","health chech-ups, focus groups","Connected, Challenging","Trinh Ngoc Nguyen Thi, Anh Hong Bui Thi","Anh Hong Bui Thi, Long Hoang Truong",Most days,Most days,Half the time,Half the time,Most days,Most days,Once a week,Once a week,Half the time,Once a week,Once a week,Half the time,Half the time,2,4,4,1,1,2,2,1,2,1,1,3,2,No,0,I'd like to know more please!
13,HR Fresher,Entry (Associate),Vietnam,Yes,Yes,Nutrition;Exercise & Fitness,Yes,Yes,football team and the company facilitates all employees to join and enjoy after work together,Yes,Yes,"pizza, guava, yogurt",Yes,gym room,No,i don't know,pending due to covid-19,surveys,"dynamic, friendly and democratic",Huy Vo / Hong Anh,Hong Anh is a member of Yoga club,Half the time,Half the time,Half the time,Half the time,Half the time,Half the time,Half the time,Half the time,Most days,Half the time,Half the time,Half the time,Half the time,6,5,6,3,1,4,2,5,3,2,4,4,4,no,0,"Maybe, depends on the time committment"
27,HR Business Manager,"Middle Management (Manager, Senior Manager)",Philippines,Yes,Yes,Exercise & Fitness;Yoga;Breathing;Mental Health;Workplace Hygiene;Leadership,Yes,Yes,"fund-raisers, fitness challenges, after-work social gatherings or e-hobby clubs.  ",Yes,Yes,"fruits, mineral water, coffee",Yes,gym,Yes,"ergonomic chair noise-cancelling headphones, stress balls","monthly non-work related check-ins, continuing education opportunities, quarterly team building/bonding","health check-ups, surveys, focus group","Safety-driven, Care for the employees, and Family",Rose Anne Nepomuceno and Alan Jimnenez,Ann Meneses and  May Lopez,Most days,Daily,Daily,Most days,Most days,Most days,Most day,Once a week,Once a week,Rarely / Never,Once a week,Once a week,Once a week,1,1,1,4,4,1,1,4,2,4,1,2,3,None,0,"Maybe, depends on the time committment"
27,Regional HR Manager,"Middle Management (Manager, Senior Manager)",India,No,Yes,Stress management;Nutrition;Exercise & Fitness;Yoga;Mindfulness;Mental Health;Holistic Wellness,Not sure,Yes,"Yoga Classes , fitness challenges, sports etc. ",No,No,,No,,Yes,Stress Balls,Yoga Classes & education opportunities ,Health chek-ups,"Respect, passionate & team building ",Alisha Abraham & Nakul Vyas,Sharon Dsouza & Sunjoy Dhaawan,Most days,Daily,Half the time,Daily,Daily,Half the time,Daily,Most days,Once a week,Rarely / Never,Daily,Daily,Most days,4,1,4,6,6,5,1,6,4,1,6,6,6,"Yes, one family tour should be sponsored from DHL may be once a year within India",1,"Yes, absolutely"
21,Manager C&B,"Middle Management (Manager, Senior Manager)",Bangladesh,Yes,Yes,Zumba Dance,No,No,,No,Yes,"Coffee, Tea",No,,No,,"Zumba Dance Session, Family Care Pack sent in Covid situation",N/A,"Highly employee engaged, Sustainable","Abu Tareq, Iftakharul Islam","Abu Tareq, Iftakharul Islam",Most days,Daily,Most days,Most days,Daily,Most days,Most day,Once a week,Once a week,Rarely / Never,Rarely / Never,Rarely / Never,Rarely / Never,1,2,2,2,2,1,1,2,2,2,1,2,2,N/A,0,I'd like to know more please!
22,HR Director,"Senior Management (Associate Director, Director, Senior Director)",Vietnam,Yes,Yes,Nutrition;Exercise & Fitness;Yoga;Leadership,Yes,Yes,"sports team, yoga class, in-house gym",Yes,Yes,"Fruits, Water, Coffee, Tea, Milk",Yes,In-house gym for certain facility,No,,"We have hobby clubs like yoga, badminton, chess, football",Annual health check-up,"Engaged, Motivated","Anh Bui, Hang Nguyen","Anh Bui, Hang Nguyen",Once a week,Most days,Once a week,Most days,Most days,Most days,Once a week,Once a week,Once a week,Once a week,Once a week,Daily,Once a week,3,3,4,4,5,5,5,5,5,2,4,4,4,NA,0,No thanks
28,Vice President - H.R ,Executive (C-Suite) or Country Head,India,Yes,Yes,Stress management;Nutrition;Exercise & Fitness;Yoga;Ergonomics;Mindfulness;Breathing;Mental Health;Holistic Wellness,No,Yes,Individual led but we support by encouraging our employees to do them & also grant off time if they need for doing such activities. ,No,No,,No,,Yes,"Yoga sessions & mats , Noise cancelling ear phones ","Meditation sessions , Yoga classes ",Health check ups and FGD,Enabling and engaging ,Alisha Abraham & Sharon D'souza ,Sharon D'souza ,Daily,Daily,Most days,Daily,Daily,Daily,Most day,Once a week,Most days,Once a week,Once a week,Most days,Half the time,1,6,6,5,4,3,2,2,1,1,2,2,1,More inclusive work place & 360 degree feedback culture is required ,1,"Yes, absolutely"
29,Manager HR,"Middle Management (Manager, Senior Manager)",India,Yes,Yes,Stress management;Exercise & Fitness;Yoga;Mindfulness;Mental Health,Yes,No,,No,Yes,Tea & Coffee,No,,No,,"Yoga Sessions, Access to Doctor on Call",Health Check Ups,"Caring, Supporting, Friendly","Sharon DSouza, Karen Mariados",Saurabh Dalvi & Sharon DSouza,Daily,Daily,Most days,Most days,Most days,Most days,Most day,Most days,Most days,Rarely / Never,Rarely / Never,Most days,Half the time,3,1,1,3,4,2,1,1,2,1,1,1,2,No,0,"Yes, absolutely"
33,Manager- Compensation & Benefits,"Middle Management (Manager, Senior Manager)",India,Yes,Yes,Stress management;Nutrition;Exercise & Fitness;Yoga;Breathing;Mental Health;Workplace Hygiene,Not sure,Yes,"Considering the current situation, all are managed virtually",No,Yes,Coffee tea and various items at the cafeteria,Yes,Rest and recreation space at office,Yes,"Yoga mat, stress balls","Yoga activities, meditation, stress relief sessions virtually ",health check ups ,"Employee centric, Openness",Alisha Abraham and Karen Mariados leads by Sunjoy Dhaawan,Sharon Barnes  and Nitish Darvekar,Most days,Most days,Most days,Most days,Most days,Most days,Rarely / Never,Most days,Most days,Most days,Most days,Once a week,Most days,1,1,1,1,1,1,1,1,1,1,1,1,1,No ,0,"Yes, absolutely"
14,Executive Talent Acquisition ,"Middle Management (Manager, Senior Manager)",India,Yes,Yes,Stress management;Nutrition;Exercise & Fitness;Yoga;Ergonomics;Mindfulness;Holistic Wellness,Not sure,No,,No,No,,No,,Yes,,"monthly Team Building, Mindfulness ",surveys,"colaborative, supportive ",Karen Mariados Alisha Abhraham,Christopher Anand ,Once a week,Half the time,Half the time,Half the time,Half the time,Half the time,Daily,Half the time,Once a week,Rarely / Never,Most days,Most days,Half the time,1,1,6,6,6,6,6,1,1,6,6,6,6,None,0,I'd like to know more please!
33,Manager HR,"Middle Management (Manager, Senior Manager)",India,Yes,Yes,Nutrition;Exercise & Fitness;Yoga;Mindfulness;Mental Health,Yes,Yes,Indoor / Sports Activities  and other Engagement Program through Cultural Club ,Yes,Yes,Mineral Water /  Coffee& Tea / Snacks ,Yes,Table Tennis /  Indoor Games ,Yes,Ergonomic chair,Monthly Health and Wellness webinar ,Health Check-ups,"Transparent, Connected , Nurturing , Flexible , Collaborative  ",Alisha Abraham ,Sharon Dsouza / Saurabh Dalvi,Daily,Daily,Daily,Daily,Most days,Most days,Most day,Most days,Most days,Once a week,Once a week,Half the time,Most days,4,4,6,3,1,1,2,5,4,2,4,4,1,Nil,0,I'd like to know more please!
26,HRBP Manager,"Middle Management (Manager, Senior Manager)",Indonesia & E. Timor,Yes,Yes,Stress management;Mindfulness;Breathing;Mental Health;financial (investment),Not sure,Yes,"before pandemic: provide room for yoga, fitness room",No,Yes,"coffee, tea, water galon",Yes,"gym room, nursery room, dining area (indoor and outdoor)",Yes,chair,"quarterly provide smart class with various topic (mental health, financial, health, etc)",survey in smart class (mindfulness),"caring, balance life style","Melisa Kurniawati, Rosalia Dwita","Rosalia Dwita, CLARISA KASHIMA LAKSMI W",Most days,Most days,Most days,Most days,Most days,Most days,Once a week,Once a week,Once a week,Once a week,Once a week,Once a week,Most days,3,3,2,2,2,2,2,2,2,2,2,2,2,sharing experience from different country could be good information,1,I'd like to know more please!
28,HR Executive,Entry (Associate),India,Yes,Yes,Stress management;Nutrition;Sleep;Exercise & Fitness;Yoga;Ergonomics;Mindfulness;Mental Health;Leadership,Yes,No,,No,No,,Yes,Social Area,Yes,"Ergonomic Chair, stress balls","Zumba Workshops, Mindfulness sessions",Health check-ups,"Collaborative, Flexible, Passionate",Saurabh Dalvi and Alisha Abraham,Saurabh Dalvi and Sharon Dsouza,Daily,Most days,Daily,Daily,Most days,Most days,Half the time,Daily,Most days,Half the time,Half the time,Once a week,Most days,4,6,3,3,1,1,1,2,3,1,2,2,3,No,0,"Maybe, depends on the time committment"
17,Human Resources Executive,Entry (Associate),Sri Lanka,Yes,No,Nothing,Yes,No,,No,No,,No,,No,,Nothing,No,"Great, Organized, Recognized",No one,None,Most days,Half the time,Most days,Most days,Daily,Most days,Rarely / Never,Half the time,Half the time,Most days,Half the time,Rarely / Never,Most days,1,1,1,1,1,1,1,1,1,1,1,1,1,None,0,"Yes, absolutely"
24,HR Assistant,Entry (Associate),Vietnam,No,Yes,Stress management;Nutrition;Exercise & Fitness;Workplace Hygiene,Yes,Yes,,No,No,"I choose no in terms of fruit, snack bars, and juice.",Yes,"Small gym (ideal for maximum 3 peoples at one time), yoga space",Yes,"relax room, noise canceling headphones...",continuing education opportunities,"health check-ups, surveys, interviews, focus groups","people-oriented,",Ms. Nguyen Kim Hang and Mr. Nguyen Hoang Minh Khang,Mr. Truong Hoang Long and Ms. Bui Thi Hong Anh,Most days,Half the time,Most days,Most days,Half the time,Most days,Half the time,Most days,Once a week,Half the time,Most days,Most days,Half the time,3,3,2,2,2,1,1,1,2,2,2,1,2,"Since Ho Chi Minh city (DHL Express VN country office based) is under severe covid 19 situation, I only, as an HR team member, hope to have more virtual engagement activities to keep our team socialized.",1,"Yes, absolutely"
14,Compensation & Benefits Senior Executive,"Middle Management (Manager, Senior Manager)",Japan,Yes,No,NA,Yes,No,,No,No,,Yes,Sports Gym support through benefits membership,No,,NA,"check-ups, mental health surveys","friendly, close with colleagues, honest","Yuichi Oana, Shoko Sato","Shoko Sato, Kyohei Morita",Half the time,Half the time,Once a week,Once a week,Half the time,Once a week,Most day,Once a week,Once a week,Once a week,Daily,Most days,Half the time,4,4,3,4,2,2,2,3,4,2,2,2,2,more opportunity to work from home,1,"Maybe, depends on the Coach"
31,"Performance, Program & Digitalization Specialist",Entry (Associate),Thailand,Yes,Yes,Nutrition;Exercise & Fitness;Workplace Hygiene,Yes,Yes,"yoga classes, tennis club, football club",Yes,Yes,"snack bars, coffee, tea, ",Yes,"gym, open space for movement",Yes,"ergonomic chair, yoga mat",yoga classes,health check-ups,"Nurturing,  Progressive, Happy","Sarayut Sarayot, Khingpai Viyanut ","Sarayut Sarayot, Khingpai Viyanut ",Most days,Daily,Daily,Most days,Most days,Most days,Once a week,Most days,Daily,Most days,Once a week,Half the time,Once a week,2,3,1,1,1,3,3,3,2,3,3,1,1,์ืNo,0,"Maybe, depends on the time committment"
14,HR Executive,Entry (Associate),Taiwan,Yes,Yes,Workplace Hygiene;Leadership,Yes,Yes,"baketball team,Employee Welfare Committee",No,Yes,"Coffee, snack vending machine",Yes,social area,Yes,"Ergonomic chair, stress balls",How to use ergonomic chairs class,health check-ups,"impositive,Pay more and more attention to the health of employees","Paul Chen,Eve Kwek","Tina Su, Terry Cheng",Once a week,Most days,Half the time,Half the time,Half the time,Once a week,Rarely / Never,Half the time,Half the time,Once a week,Rarely / Never,Once a week,Once a week,1,1,3,4,2,2,2,2,1,2,3,1,2,N/A,0,"Maybe, depends on the time committment"
29,"Director, Human Resources","Senior Management (Associate Director, Director, Senior Director)",Bangladesh,Yes,Yes,Exercise & Fitness;Yoga;Workplace Hygiene;Leadership,No,No,,No,No,,No,,No,,not applicable,surveys,"participative, affirmative","Taufica, Tareq","Tareq, Tapas",Once a week,Daily,Daily,Daily,Daily,Daily,Daily,Most days,Most days,Once a week,Most days,Most days,Most days,1,1,1,1,1,1,1,1,1,1,1,1,1,Quality of Work should be improved not only by balancing rather enhancing both of the work and personal life ,1,"Yes, absolutely"
25,HR/Safety Officer,Entry (Associate),Philippines,Yes,Yes,Mental Health;Workplace Hygiene;Leadership,Yes,Yes,Sports Teams - They are supported in terms of financial ,Yes,Yes,"Free Meals, any kinds of meals",Yes,"Gym, Lounge",Yes,ergonomic chair,"Team Bonding, continuing education opportunities","Health Check up, focus group discussion","Grateful, Comfortable","Erica, Lee, Maville Alferez","Erica, Lee, Maville Alferez",Half the time,Most days,Daily,Most days,Most days,Most days,Rarely / Never,Half the time,Half the time,Rarely / Never,Rarely / Never,Most days,Half the time,2,2,2,1,1,1,2,1,2,3,1,2,1,N/A,0,"Maybe, depends on the time committment"
17,Resourcing Executive,Entry (Associate),Taiwan,Yes,Yes,Exercise & Fitness;Workplace Hygiene;Leadership,No,Yes,Encourage employees to join the sports teams.,No,Yes,"milk, juice, boiled chicken, snacks",No,,No,,High quality office chair,not sure,"supportive, stable, friendly",Eve Kwek,Kelly Shih,Half the time,Half the time,Most days,Once a week,Half the time,Once a week,Most day,Daily,Once a week,Once a week,Most days,Daily,Once a week,3,1,5,3,2,2,1,2,2,4,1,4,2,NA,0,"Maybe, depends on the time committment"
22,Employee Relations Executive,Entry (Associate),South Korea,Yes,Yes,Yoga,Yes,Yes,"Support to run hobby club (soccer, baseball, tennis etc.) ",No,No,,No,,Yes,phone booths ,"health check-ups, inviting a trainer to help Ops employees to warm-up before starting to work ",Employee opinion survey,"improving, global",byungwoo son (in charge of organizing HR get-togethers this year),byungwoo son,Half the time,Most days,Most days,Most days,Most days,Half the time,Most day,Half the time,Half the time,Rarely / Never,Once a week,Half the time,Most days,3,4,5,3,3,1,2,3,3,1,2,2,4,"The approach of QWL sounds good, but it shouldn't be another burden at work. ",1,No thanks
31,Payroll Outsourcing Project Manager,"Middle Management (Manager, Senior Manager)",Taiwan,Yes,Yes,Mental Health,Yes,Yes,Our company provided a lot of free activities.,Yes,Yes,"coffee, tea, water, healthy snack",Yes,open space for movement,Yes,"ergonomic chair, noise-cancelling headphones",monthly team building workshops / on line wellness activities,"health check-ups, surveys, interviews","wellness, warm","Terry Cheng, Liana Xie, Kelly Shih","Terry Cheng, Liana Xie, Kelly Shih",Most days,Most days,Daily,Daily,Most days,Daily,Half the time,Most days,Daily,Once a week,Half the time,Once a week,Daily,5,6,4,6,6,5,6,6,6,6,6,6,6,No,0,"Maybe, depends on the time committment"
19,HR Assistant,Entry (Associate),Vietnam,Yes,Yes,Nutrition;Sleep;Exercise & Fitness;Mindfulness;Mental Health;Workplace Hygiene,Not sure,Yes,,No,Yes,,Yes,,Yes,,"Yoga club, Healthy eating workshop",health check-ups,"Funny, safety",NOPE,NOPE,Most days,Most days,Most days,Half the time,Most days,Most days,Half the time,Half the time,Rarely / Never,Half the time,Rarely / Never,Half the time,Half the time,2,1,2,2,2,1,1,3,2,4,3,2,2,NOEP,0,"Maybe, depends on the Coach"
25,HR Executive,Entry (Associate),Taiwan,Yes,Yes,Exercise & Fitness;Yoga;Ergonomics;Workplace Hygiene;Environmental Protection,Yes,Yes,"Employees can join together to form a club, and reimburse according to the held events within the limit from Employee Welfare Committee.",No,Yes,coffee,Yes,Social Area,Yes,Ergonomic Chair,"Health related seminars, team building activities ","Health check-ups, surveys","Caring, Engaging, United","Terry Cheng, Eve Kwek","Kelly Shih, Terry Cheng",Most days,Most days,Daily,Most days,Half the time,Half the time,Half the time,Daily,Half the time,Rarely / Never,Once a week,Daily,Half the time,4,4,6,4,3,5,5,6,5,3,5,4,6,"Although we're pushing hard for gathering and holding activities online during the pandemic, the physically events do connect and engage people more.",1,"Maybe, depends on the time committment"
35,Human Resource Executive,Entry (Associate),Thailand,Yes,Yes,Leadership,Yes,Yes,Sport teams such as Badminton and Football by build up small Football field in some of Service Center. ,Yes,Yes,"Snack and drinking vending machine, coffee & tea, Ice maker. ",Yes,"Gym, open space for movement, social area. ",Yes,"stress balls, yoga mat. ","Weekly special delivery for Team engagement, Giveaway medicine box for those who is Homeisolation. ",Yearly health check-up,"Respectful, Happy, Connected. ","Sinee Kesdech; Team Activities and Friday Lunch box, Sarayut Sarayot; Team building and outing, game, and Karaoke","Penphat Rutthananurak (Encourages wellness about well being in both health and metal),  Sarayut Sarayot (Fitness clasee at home)",Daily,Daily,Daily,Daily,Daily,Daily,Most day,Daily,Daily,Once a week,Once a week,Daily,Daily,2,1,3,2,1,2,2,1,1,2,1,2,2,-,0,"Yes, absolutely"
29,Employee Data Administrator,Entry (Associate),Fiji,Yes,Yes,Exercise & Fitness,Yes,Yes,"Organizing global volunteer day and environment day, assisting committee and helping maintain environment",Yes,Yes,"Mineral water, Coffee, Tea",No,,No,,Monthly Team Building,Health check ups,Healthy working environment,"Shivneel Narayan, Shayal arishma","Kavish Prasad, Rahul Samli",Daily,Daily,Daily,Daily,Daily,Daily,Once a week,Half the time,Half the time,Rarely / Never,Daily,Daily,Most days,1,2,2,1,1,1,1,1,1,1,1,1,1,no,0,I'd like to know more please!
31,"Manager, HR","Middle Management (Manager, Senior Manager)",Fiji,Yes,Yes,Nutrition;Exercise & Fitness;Mindfulness;Workplace Hygiene;Leadership,Yes,Yes,"Soccer team, Fiji Cup - soccer and Volleyball game, OHS walks, team building activities, etc. ",No,Yes,"Coffee, tea, bottle water on daily basis. others, like CIS training or workshop, provide snack bar, juice, etc. ",No,"lunch room or small meeting room if need, employee can book the room to use as H&W facilities",No,"not at the moment due to current limited working space. for future plan, this might be considered into","Fitness and wellbeing benefit introduced, staff can choose their desirable H&W + fitness program or equipment. ","introducing yearly health checkup, pending for this year due to COVID status in country. might be in Q4 this year","Great place to work, caring employee's wellbeing, Open and two ways, motivating","Shayal Arishma, Shivneel Narayan","Shayal Arishma, Kavish Prasad",Most days,Most days,Daily,Most days,Daily,Daily,Half the time,Most days,Most days,Half the time,Most days,Most days,Half the time,1,1,4,3,2,2,1,2,2,1,1,1,1,we need to spend the quality time on balancing work life style ,1,I'd like to know more please!
34,HR Specialist,Executive,Sri Lanka,Yes,Yes,Stress management;Mental Health;Holistic Wellness;Leadership,Yes,Yes,"Sports Activities, Fitness challenges, After - work social gathering",Yes,Yes,"Bottled mineral water, snacks, coffee, tea",Yes,"open space for movement, social area, digital library",Yes," stress balls,noise-cancelling headphones, phone booths"," continuing education opportunities, team building workshops"," health check-ups,focus groups","Flexible, Friendly, Peacefully","Tharaka De Silva, Asaranagi Jagoda","Tharaka De Silva, Asaranagi Jagoda",Daily,Daily,Daily,Daily,Daily,Daily,Most day,Once a week,Most days,Rarely / Never,Once a week,Most days,Most days,5,4,6,5,1,1,1,5,5,4,4,4,2,Focusing on managing working hrs,1,"Yes, absolutely"
